{
  "$schema": "./journey.schema.json",
  "id": "joyce-journey-2026",
  "title": "Joyce Journey",
  "subtitle": "Iceland + Ireland",
  "year": 2026,
  "dateRange": { "start": "2026-08-28", "end": "2026-09-04" },
  "travelerIds": ["john-joyce", "travel-companion"],
  "travelers": [
    { "id": "john-joyce", "displayName": "John Joyce" },
    { "id": "travel-companion", "displayName": "Travel companion" }
  ],
  "locations": [
    { "id": "nashville", "name": "Nashville", "country": "United States", "countryCode": "US", "mapQuery": "Nashville International Airport" },
    { "id": "keflavik", "name": "Keflavík", "country": "Iceland", "countryCode": "IS", "mapQuery": "Keflavik Iceland" },
    { "id": "hafnargata", "name": "Hafnargata", "locality": "Keflavík", "country": "Iceland", "countryCode": "IS", "mapQuery": "Hafnargata Keflavik" },
    { "id": "dublin-airport", "name": "Dublin Airport", "country": "Ireland", "countryCode": "IE", "mapQuery": "Dublin Airport" },
    { "id": "galway", "name": "Galway", "country": "Ireland", "countryCode": "IE", "mapQuery": "Galway Ireland" },
    { "id": "leonardo-galway", "name": "Leonardo Hotel Galway", "address": "Quay Street, Galway, H91 E8D7", "country": "Ireland", "countryCode": "IE", "mapQuery": "Leonardo Hotel Galway" },
    { "id": "cong", "name": "Cong", "country": "Ireland", "countryCode": "IE", "mapQuery": "Cong Ireland" },
    { "id": "ryans-river-lodge", "name": "Ryan’s River Lodge", "locality": "Cong", "country": "Ireland", "countryCode": "IE", "mapQuery": "Ryan's River Lodge Cong" },
    { "id": "athlone", "name": "Athlone", "country": "Ireland", "countryCode": "IE", "mapQuery": "Athlone Ireland" },
    { "id": "athlone-flat", "name": "Cosy Relaxing Flat above Organic Grocer", "locality": "Athlone", "country": "Ireland", "countryCode": "IE", "mapQuery": "Athlone Ireland" },
    { "id": "howth", "name": "Howth", "country": "Ireland", "countryCode": "IE", "mapQuery": "Howth Harbour" },
    { "id": "king-sitric", "name": "King Sitric", "locality": "Howth", "country": "Ireland", "countryCode": "IE", "mapQuery": "King Sitric Howth" },
    { "id": "newgrange", "name": "Brú na Bóinne Visitor Centre / Newgrange", "country": "Ireland", "countryCode": "IE", "mapQuery": "Bru na Boinne Visitor Centre" },
    { "id": "boston", "name": "Boston Logan Airport", "country": "United States", "countryCode": "US", "mapQuery": "Boston Logan Airport" }
  ],
  "notices": [],
  "reservations": [
    { "id": "res-fi824", "type": "flight", "title": "Icelandair FI824", "date": "2026-08-28", "startTime": "20:55", "endDate": "2026-08-29", "endTime": "08:40", "originLocationId": "nashville", "destinationLocationId": "keflavik", "anchorStatus": "protected", "confirmationStatus": "confirmed", "verificationSource": "traveler-verified", "publicNote": "Nashville to Keflavík." },
    { "id": "res-keflavik-lodging", "type": "lodging", "title": "Hafnargata lodging", "date": "2026-08-29", "startTime": "14:00", "endDate": "2026-08-30", "endTime": "10:00", "locationId": "hafnargata", "anchorStatus": "fixed", "confirmationStatus": "confirmed", "verificationSource": "traveler-verified", "publicNote": "Hosted by Haydar." },
    { "id": "res-fi416", "type": "flight", "title": "Icelandair FI416", "date": "2026-08-30", "startTime": "07:30", "endTime": "11:05", "originLocationId": "keflavik", "destinationLocationId": "dublin-airport", "anchorStatus": "protected", "confirmationStatus": "confirmed", "verificationSource": "traveler-verified", "publicNote": "Keflavík to Dublin." },
    { "id": "res-budget-car", "type": "rental-car", "title": "Budget rental car", "date": "2026-08-30", "endDate": "2026-09-04", "locationId": "dublin-airport", "anchorStatus": "fixed", "confirmationStatus": "confirmed", "verificationSource": "traveler-verified", "publicNote": "Dublin Airport pickup and return. Confirm toll handling at pickup." },
    { "id": "res-galway-lodging", "type": "lodging", "title": "Leonardo Hotel Galway", "date": "2026-08-30", "endDate": "2026-08-31", "locationId": "leonardo-galway", "anchorStatus": "fixed", "confirmationStatus": "confirmed", "verificationSource": "traveler-verified", "publicNote": "First Ireland lodging." },
    { "id": "res-cong-lodging", "type": "lodging", "title": "Ryan’s River Lodge", "date": "2026-08-31", "startTime": "15:00", "endDate": "2026-09-02", "locationId": "ryans-river-lodge", "anchorStatus": "fixed", "confirmationStatus": "needs-verification", "verificationSource": "prototype", "publicNote": "Cong lodging; check-in details need traveler verification." },
    { "id": "res-sheepdogs", "type": "experience", "title": "Joyce Country Sheepdogs", "date": "2026-09-01", "startTime": "09:30", "locationId": "cong", "anchorStatus": "fixed", "confirmationStatus": "needs-verification", "verificationSource": "prototype", "publicNote": "Primary sheepdog demonstration; confirm reservation details." },
    { "id": "res-athlone-lodging", "type": "lodging", "title": "Cosy Relaxing Flat above Organic Grocer", "date": "2026-09-02", "startTime": "15:00", "endDate": "2026-09-03", "endTime": "12:00", "locationId": "athlone-flat", "anchorStatus": "fixed", "confirmationStatus": "confirmed", "verificationSource": "traveler-verified", "publicNote": "Hosted by Lynda. Athlone is the September 2 home base." },
    { "id": "res-newgrange", "type": "timed-attraction", "title": "Brú na Bóinne Tour — Newgrange Chamber", "date": "2026-09-03", "startTime": "12:00", "locationId": "newgrange", "partySize": 2, "anchorStatus": "protected", "confirmationStatus": "confirmed", "verificationSource": "traveler-verified", "publicNote": "Tours begin through the visitor centre; advance arrival is required." },
    { "id": "res-howth-lodging", "type": "lodging", "title": "King Sitric", "date": "2026-09-03", "startTime": "15:00", "endDate": "2026-09-04", "endTime": "11:00", "endTimeQualifier": "before", "locationId": "king-sitric", "anchorStatus": "fixed", "confirmationStatus": "confirmed", "verificationSource": "traveler-verified", "publicNote": "Howth lodging after Athlone." },
    { "id": "res-king-sitric-dinner", "type": "dining", "title": "King Sitric Seafood Bar", "date": "2026-09-03", "startTime": "18:00", "locationId": "king-sitric", "partySize": 2, "anchorStatus": "protected", "confirmationStatus": "confirmed", "verificationSource": "traveler-verified", "publicNote": "Confirmed dinner featuring local seafood beside Howth Harbour." },
    { "id": "res-jetblue-354", "type": "flight", "title": "JetBlue 354: Dublin to Boston", "date": "2026-09-04", "startTime": "10:40", "originLocationId": "dublin-airport", "destinationLocationId": "boston", "anchorStatus": "protected", "confirmationStatus": "needs-verification", "verificationSource": "prototype", "publicNote": "Transatlantic departure details need traveler verification." },
    { "id": "res-jetblue-507", "type": "flight", "title": "JetBlue 507: Boston to Nashville", "date": "2026-09-04", "startTime": "16:55", "originLocationId": "boston", "destinationLocationId": "nashville", "anchorStatus": "protected", "confirmationStatus": "needs-verification", "verificationSource": "prototype", "publicNote": "Connection details need traveler verification." }
  ],
  "days": [
    {
      "id": "day-2026-08-29", "date": "2026-08-29", "displayDate": "Sat, Aug 29", "title": "Iceland: Fire, Water & Atlantic Coast", "baseLocationId": "keflavik", "reservationIds": ["res-fi824", "res-keflavik-lodging"],
      "stops": [
        { "id": "bridge-continents", "time": "8:30 AM", "title": "Bridge Between Continents", "description": "Walk between the North American and Eurasian tectonic plates.", "note": "Restroom plan: use facilities in Keflavík before departure; confirm seasonal facilities.", "mapQuery": "Bridge Between Continents Iceland", "flexibilityStatus": "flexible" },
        { "id": "gunnuhver", "time": "9:30 AM", "title": "Gunnuhver Geothermal Area", "description": "Boardwalk views of powerful steam vents and boiling mud.", "note": "Short walk; remain on marked paths.", "mapQuery": "Gunnuhver Iceland", "flexibilityStatus": "flexible" },
        { "id": "reykjanesviti", "time": "10:30 AM", "title": "Reykjanesviti Lighthouse & Valahnúkamöl", "description": "Lighthouse, sea stacks and dramatic Atlantic cliffs.", "note": "Use caution in wind and stay back from waves.", "mapQuery": "Reykjanesviti Lighthouse", "flexibilityStatus": "flexible" },
        { "id": "iceland-lunch", "time": "12:00 PM", "title": "Lunch & Restroom Break", "description": "Return toward a staffed café or hotel area for a dependable restroom stop.", "note": "Build flexibility around IBS needs.", "mapQuery": "Keflavik restaurants", "flexibilityStatus": "flexible" },
        { "id": "lagoon", "time": "1:30 PM", "title": "Blue Lagoon or Sky Lagoon Alternative", "description": "A comfortable, restroom-rich geothermal experience; advance booking required.", "note": "Check volcanic access and operating status before travel.", "mapQuery": "Blue Lagoon Iceland", "flexibilityStatus": "optional" },
        { "id": "kleifarvatn", "time": "4:30 PM", "title": "Kleifarvatn Scenic Stop", "description": "Volcanic lake and stark lava scenery without a long drive.", "note": "Optional if energy and conditions permit.", "mapQuery": "Kleifarvatn Iceland", "flexibilityStatus": "optional" },
        { "id": "keflavik-dinner", "time": "6:30 PM", "title": "Dinner in Keflavík", "description": "Relax near your lodging before the early flight.", "note": "Keep the evening easy.", "mapQuery": "Keflavik Iceland", "flexibilityStatus": "flexible" }
      ],